<?xml version="1.0" encoding="UTF-8"?>

<rezepte xmlns="http://www.gm.fh-koeln.de/~mi1242/wba2/rezepte"
         xmlns:xsi="http://www.w3.org/2001/XMLSchema-instance"
         xsi:schemaLocation="Aufgabe3c.xsd">
    <rezept id="345">
        <photos>
            <photo id="1" width="100" height="100" src="http://static.chefkoch-cdn.de/ck.de/rezepte/2/2464/31970-960x720-lenchen-s-schokoladenkuchen.jpg">beast354</photo>
            <photo id="2" width="100" height="100" src="http://static.chefkoch-cdn.de/ck.de/rezepte/2/2464/31970-960x720-lenchen-s-schokoladenkuchen.jpg">Klaus</photo>
            <photo id="3" width="100" height="100" src="http://static.chefkoch-cdn.de/ck.de/rezepte/2/2464/31970-960x720-lenchen-s-schokoladenkuchen.jpg">Hans</photo>
            <!-- usw. -->
        </photos>
        <zutaten>
            <zutat menge="200" einheit="g">Butter</zutat>
            <zutat menge="200" einheit="g">Zucker</zutat>
            <zutat menge="200" einheit="g">
                <link src="http://www.gm.fh-koeln.de/~mi1242/wba2/rezepte/zutaten/Schokolade">Schokolade</link>
                <link src="http://www.gm.fh-koeln.de/~mi1242/wba2/rezepte/zutaten/Blockschokolade">Blockschokolade</link>
            </zutat>
            <zutat menge="120" einheit="g">Mehl</zutat>
            <zutat menge="0.5" einheit="TL">Backpulver</zutat>
            <zutat menge="1" einheit="Pkt">Vanillezucker</zutat>
            <zutat menge="4" einheit="Stk">
                <link src="http://www.gm.fh-koeln.de/~mi1242/wba2/rezepte/zutaten/Ei">Ei(er)</link>
            </zutat>
            <!-- usw. -->
        </zutaten>
        <schwierigkeit value="normal" />
        <arbeitszeit value="60" />
        <brennwert value="295" einheit="kcal"/>
        <zubereitung>Butter und Schokolade im Wasserbad schmelzen. Eier trennen. Eiweiß steif schlagen. Eigelbe, Zucker und Vanillezucker verrühren. Geschmolzene Butter-Schokomasse hinzufügen und mischen. Mehl mit dem Backpulver in die Masse sieben und zum Schluss die steifen Eiweiße vorsichtig unterheben. In eine gut gefettete Form geben.
Bei 180°Grad 40 – 50 Minuten backen.
        </zubereitung>
        <socialnetworks>
            <network name="facebook">723785992</network>
            <network name="googleplus">74478238</network>
            <network name="twitter">98347582</network>
            <!-- usw. -->
        </socialnetworks>
    </rezept>
</rezepte>
